{
 "schema_version": 1,
 "layer": "answer quality — the four RAGAS metric definitions, implemented in this repository",
 "vintage": "2026-10-29",
 "generated_at": "2026-10-29T05:46:08+00:00",
 "status": "measured",
 "metric_source": {
  "library": false,
  "why": "the `ragas` package is not installed in this repository or on this machine, and the answering path is deliberately dependency-free; the definitions are implemented in scripts/eval_answer_quality.py",
  "definitions": {
   "faithfulness": "supported statements / statements in the answer",
   "answer_relevancy": "mean cosine(question, question generated from the answer)",
   "context_precision": "average precision over cited chunks judged useful",
   "context_recall": "reference claims attributable to the contexts / reference claims"
  },
  "comparability": "scores are NOT comparable to a `ragas` library run: the prompt, the decomposition and the call pattern are this repository's",
  "call_pattern": "one structured judge call per question plus one batched embedding call, because this key's free tier allows 20 requests per window",
  "prompt_sha256": "597a7dcb070eaaf185aa669d03df9e74d0cffa65d82fbc1ac3769ca432bec33c"
 },
 "judge": {
  "provider": "Google Generative Language REST",
  "model": "gemini-3.5-flash-lite",
  "temperature": 0.0,
  "embedding_model": "gemini-embedding-001",
  "embedding_dim": 768,
  "n_generated_questions": 3,
  "max_contexts": 4,
  "calls": 30
 },
 "inputs": {
  "corpus": "registry/rag/2026-10-29/corpus.json",
  "corpus_content_sha256": "6d957397279f0ca11cf7b43c6220382cd0e57ded7143e3d1e3be835a5e9400ed",
  "answer_eval": "registry/rag/2026-10-29/answer_eval.json",
  "answer_eval_content_sha256": "5ce084e78966d56fcbec747e6651a2ab1d21e2d6a3e1755f36320559293d9deb",
  "eval_set": "registry/rag/2026-10-29/eval_set.json",
  "eval_set_content_sha256": "8a9c81e594dcd6aa093f1d38e74ea6d633a99eb298475f4807319ea1d9b70d11"
 },
 "scored": 15,
 "expected": 15,
 "excluded": [
  {
   "id": "q06_design_c_status",
   "why": "status=declined"
  },
  {
   "id": "heldout_M1_01",
   "why": "status=answered"
  },
  {
   "id": "heldout_M1_02",
   "why": "status=answered"
  },
  {
   "id": "heldout_M1_03",
   "why": "status=answered"
  },
  {
   "id": "heldout_M1_04",
   "why": "status=answered"
  },
  {
   "id": "heldout_M1_05",
   "why": "status=answered"
  },
  {
   "id": "heldout_M1_06",
   "why": "status=answered"
  },
  {
   "id": "heldout_M1_07",
   "why": "status=answered"
  },
  {
   "id": "heldout_M1_08",
   "why": "status=answered"
  },
  {
   "id": "heldout_M1_09",
   "why": "status=answered"
  },
  {
   "id": "heldout_M1_10",
   "why": "status=answered"
  },
  {
   "id": "heldout_M1_11",
   "why": "status=answered"
  },
  {
   "id": "heldout_M1_12",
   "why": "status=answered"
  },
  {
   "id": "heldout_D01",
   "why": "status=answered"
  },
  {
   "id": "heldout_D02",
   "why": "status=answered"
  },
  {
   "id": "heldout_D03",
   "why": "status=answered"
  },
  {
   "id": "heldout_D04",
   "why": "status=answered"
  },
  {
   "id": "heldout_D05",
   "why": "status=answered"
  },
  {
   "id": "heldout_D06",
   "why": "status=answered"
  },
  {
   "id": "heldout_D07",
   "why": "status=answered"
  },
  {
   "id": "heldout_D08",
   "why": "status=answered"
  },
  {
   "id": "heldout_D09",
   "why": "status=declined"
  },
  {
   "id": "heldout_D10",
   "why": "status=answered"
  }
 ],
 "metrics": {
  "faithfulness": 0.955983,
  "answer_relevancy": 0.806088,
  "context_precision": 0.977778,
  "context_recall": 0.792222
 },
 "caveats": [
  "faithfulness is near 1.0 by construction when the answer is a selection of quoted corpus paragraphs — it measures the contract, not the retrieval's judgement",
  "the judge is one model at temperature 0; a different judge would move these numbers",
  "the free tier throttles, so the run is resumable rather than fast: a question is scored once and skipped on the next run"
 ],
 "questions": [
  {
   "id": "q01_fatalities_elasticity",
   "question": "What did the published estimate find for the effect of FAAC allocations on reported fatalities?",
   "contexts": [
    "estimate:fatalities__A"
   ],
   "answer_chars": 1385,
   "scores": {
    "faithfulness": 1.0,
    "answer_relevancy": 0.803804,
    "context_precision": 1.0,
    "context_recall": 1.0
   },
   "detail": {
    "statements": [
     "The published specification is Design A on fatalities.",
     "The elasticity of fatalities to allocation is +0.4793.",
     "The standard error is 0.3023.",
     "The 95% interval is [-0.1132, +1.0718].",
     "The p-value is 0.1129.",
     "The sample size is 3,456 state-months over 36 states.",
     "The date range is 2016-12-01 to 2024-12-01.",
     "The verdict is estimated_not_identified.",
     "The lead-shift p-value is 0.133.",
     "8 of 60 mis-timed doses return an estimate at least as large as the estimate itself.",
     "The identifying assumption is parallel trends.",
     "The design cannot rule out anticipation.",
     "The design cannot rule out SUTVA violations through cross-state spillovers.",
     "The design cannot rule out compositional or definitional change in state accounts over the window.",
     "The dose itself may be contaminated by the policy it measures."
    ],
    "statement_supported": [
     true,
     true,
     true,
     true,
     true,
     true,
     true,
     true,
     true,
     true,
     true,
     true,
     true,
     true,
     true
    ],
    "generated_questions": [
     "What is the published estimate for the effect of FAAC allocations on reported fatalities under Design A?",
     "What is the verdict and lead-shift p-value for the FAAC allocations and fatalities estimate?",
     "What limitations and identifying assumptions are associated with the fatalities Design A estimate?"
    ],
    "similarities": [
     0.926735,
     0.827085,
     0.657593
    ],
    "context_usable": [
     true
    ],
    "reference_claims": [
     "The published Design A specification is a PPML elasticity of fatalities to the logged gross FAAC allocation of +0.4793 (SE 0.3023).",
     "The 95% interval is [-0.1132, +1.0718].",
     "The p-value is 0.1129.",
     "The analysis is on 3,456 state-months for 36 states from 2016-12 to 2024-12.",
     "The interval crosses zero.",
     "The verdict is estimated_not_identified."
    ],
    "claim_supported": [
     true,
     true,
     true,
     true,
     true,
     true
    ],
    "judge_replied": true
   }
  },
  {
   "id": "q02_fatalities_identified",
   "question": "Is the fatality estimate identified, and which check decided that?",
   "contexts": [
    "estimate:fatalities__A"
   ],
   "answer_chars": 1356,
   "scores": {
    "faithfulness": 0.923077,
    "answer_relevancy": 0.859744,
    "context_precision": 1.0,
    "context_recall": 0.8
   },
   "detail": {
    "statements": [
     "The published specification is Design A on fatalities: elasticity_of_fatalities_to_allocation = +0.4793.",
     "The standard error of the elasticity of fatalities to allocation is 0.3023.",
     "The 95% interval is [-0.1132, +1.0718].",
     "The p-value is 0.1129.",
     "The sample size is 3,456 state-months over 36 states.",
     "The time window is 2016-12-01 to 2024-12-01.",
     "The verdict is estimated_not_identified.",
     "The lead-shift p-value is 0.133.",
     "8 of 60 mis-timed doses return an estimate at least as large as the estimate itself.",
     "The identifying assumption is parallel trends: absent the policy shift, states with different exposure intensities would have followed parallel outcome paths.",
     "Formally, no unmeasured state-by-time confounder affects both the dose and the outcome.",
     "The design cannot rule out anticipation, SUTVA violations, compositional or definitional changes, or dose contamination.",
     "The citation is Card estimate — Reported security fatalities under Design A — registry/dags/fatalities__A.json (vintage 2026-10-29) — estimate:fatalities__A."
    ],
    "statement_supported": [
     true,
     true,
     true,
     true,
     true,
     true,
     true,
     true,
     true,
     true,
     true,
     true,
     false
    ],
    "generated_questions": [
     "Is the fatality estimate identified, and which check decided that?",
     "What are the statistical details and verdict for the fatality estimate under Design A?",
     "What limitations and identifying assumptions apply to the fatality estimate?"
    ],
    "similarities": [
     1.0,
     0.765522,
     0.813709
    ],
    "context_usable": [
     true
    ],
    "reference_claims": [
     "No, the fatality estimate is not identified.",
     "The pre-declared rule requires a lead-shift p-value below 0.05 and a 24-month placebo smaller than the estimate.",
     "The lead-shift p-value is 0.133.",
     "8 of 60 mis-timed doses returned an estimate at least as large as the published one.",
     "The verdict is estimated_not_identified."
    ],
    "claim_supported": [
     true,
     false,
     true,
     true,
     true
    ],
    "judge_replied": true
   }
  },
  {
   "id": "q03_incidents_interval",
   "question": "What is the point estimate and 95 % interval for the effect on the number of reported incidents?",
   "contexts": [
    "estimate:incidents__A"
   ],
   "answer_chars": 1382,
   "scores": {
    "faithfulness": 1.0,
    "answer_relevancy": 0.787883,
    "context_precision": 1.0,
    "context_recall": 1.0
   },
   "detail": {
    "statements": [
     "The published specification is Design A on incidents.",
     "The elasticity_of_fatalities_to_allocation is +0.5460.",
     "The standard error is 0.2168.",
     "The 95% interval is [+0.1211, +0.9709].",
     "The p-value is 0.0118.",
     "The sample size is 3,456 state-months over 36 states.",
     "The time period is 2016-12-01 to 2024-12-01.",
     "The verdict is estimated_not_identified.",
     "The lead-shift p-value is 0.133.",